<?xml version="1.0" encoding="utf-8"?>
<Prefab xmlns:xsi="http://www.w3.org/2001/XMLSchema-instance"
        xsi:noNamespaceSchemaLocation="../../schemas/gauntletui.xsd">
  
  <!-- Hero Editor Left Column Component -->
  <Widget Id="HeroEditor.InfoColumn">
    <Children>
      <HeroInfoColumn />
    </Children>
  </Widget>

  <!-- Hero Editor Center Column Component -->
  <Widget Id="HeroEditor.CharacterColumn">
    <Children>
      <HeroCharacterColumn />
    </Children>
  </Widget>

  <!-- Hero Editor Right Column Component -->
  <Widget Id="HeroEditor.SkillsColumn">
    <Children>
      <HeroSkillsColumn />
    </Children>
  </Widget>

</Prefab>
